{
  "schemaVersion": 1,
  "lane": "E",
  "commit": "93b3ed8087c2d842400113ba9f988c05bdbc6b28",
  "ci": {
    "runUrl": "https://github.com/pavo-bit/erp/actions/runs/41305764290"
  },
  "jobs": [
    {
      "name": "security-scan",
      "status": "FAIL",
      "url": "https://github.com/pavo-bit/erp/actions/runs/41305764290/job/124845701584",
      "commit": "93b3ed8087c2d842400113ba9f988c05bdbc6b28",
      "detail": "npm audit --audit-level=high failed: 89 findings (2 low, 54 moderate, 31 high, 2 critical); Trivy was skipped."
    },
    {
      "name": "frontend-build (saas-frontend)",
      "status": "PASS",
      "url": "https://github.com/pavo-bit/erp/actions/runs/41305764290/job/124845701680",
      "commit": "93b3ed8087c2d842400113ba9f988c05bdbc6b28"
    },
    {
      "name": "backend-type-check",
      "status": "PASS",
      "url": "https://github.com/pavo-bit/erp/actions/runs/41305764290/job/124845701719",
      "commit": "93b3ed8087c2d842400113ba9f988c05bdbc6b28"
    },
    {
      "name": "backend-test (lane f)",
      "status": "FAIL",
      "url": "https://github.com/pavo-bit/erp/actions/runs/41305764290/job/124845701725",
      "commit": "93b3ed8087c2d842400113ba9f988c05bdbc6b28",
      "detail": "Fresh Vitest run: 13 files failed, 12 passed; 73 tests failed, 96 passed, 0 skipped (169 total)."
    },
    {
      "name": "backend-test (lane e)",
      "status": "FAIL",
      "url": "https://github.com/pavo-bit/erp/actions/runs/41305764290/job/124845701738",
      "commit": "93b3ed8087c2d842400113ba9f988c05bdbc6b28",
      "detail": "Fresh Vitest run: 13 files failed, 12 passed; 73 tests failed, 96 passed, 0 skipped (169 total)."
    },
    {
      "name": "frontend-build (super-admin)",
      "status": "PASS",
      "url": "https://github.com/pavo-bit/erp/actions/runs/41305764290/job/124845701746",
      "commit": "93b3ed8087c2d842400113ba9f988c05bdbc6b28"
    },
    {
      "name": "Migrate and RLS Tests (restricted role)",
      "status": "PASS",
      "url": "https://github.com/pavo-bit/erp/actions/runs/41305764290/job/124845701756",
      "commit": "93b3ed8087c2d842400113ba9f988c05bdbc6b28"
    },
    {
      "name": "backend-test (lane d)",
      "status": "FAIL",
      "url": "https://github.com/pavo-bit/erp/actions/runs/41305764290/job/124845701776",
      "commit": "93b3ed8087c2d842400113ba9f988c05bdbc6b28",
      "detail": "Fresh Vitest run: 13 files failed, 12 passed; 73 tests failed, 96 passed, 0 skipped (169 total)."
    },
    {
      "name": "backend-test (lane b)",
      "status": "FAIL",
      "url": "https://github.com/pavo-bit/erp/actions/runs/41305764290/job/124845701788",
      "commit": "93b3ed8087c2d842400113ba9f988c05bdbc6b28",
      "detail": "Fresh Vitest run: 13 files failed, 12 passed; 73 tests failed, 96 passed, 0 skipped (169 total)."
    },
    {
      "name": "frontend-build (student-portal)",
      "status": "PASS",
      "url": "https://github.com/pavo-bit/erp/actions/runs/41305764290/job/124845701795",
      "commit": "93b3ed8087c2d842400113ba9f988c05bdbc6b28"
    },
    {
      "name": "backend-test (lane a)",
      "status": "FAIL",
      "url": "https://github.com/pavo-bit/erp/actions/runs/41305764290/job/124845701802",
      "commit": "93b3ed8087c2d842400113ba9f988c05bdbc6b28",
      "detail": "Fresh Vitest run: 13 files failed, 12 passed; 73 tests failed, 96 passed, 0 skipped (169 total)."
    },
    {
      "name": "backend-test (lane c)",
      "status": "FAIL",
      "url": "https://github.com/pavo-bit/erp/actions/runs/41305764290/job/124845701826",
      "commit": "93b3ed8087c2d842400113ba9f988c05bdbc6b28",
      "detail": "Fresh Vitest run: 13 files failed, 12 passed; 73 tests failed, 96 passed, 0 skipped (169 total)."
    },
    {
      "name": "frontend-build (payment-portal)",
      "status": "PASS",
      "url": "https://github.com/pavo-bit/erp/actions/runs/41305764290/job/124845701829",
      "commit": "93b3ed8087c2d842400113ba9f988c05bdbc6b28"
    },
    {
      "name": "backend-lint",
      "status": "FAIL",
      "url": "https://github.com/pavo-bit/erp/actions/runs/41305764290/job/124845701830",
      "commit": "93b3ed8087c2d842400113ba9f988c05bdbc6b28",
      "detail": "ESLint reported 520 problems (519 errors, 1 warning)."
    },
    {
      "name": "frontend-build (teacher-portal)",
      "status": "PASS",
      "url": "https://github.com/pavo-bit/erp/actions/runs/41305764290/job/124845701831",
      "commit": "93b3ed8087c2d842400113ba9f988c05bdbc6b28"
    },
    {
      "name": "frontend-build (parent-portal)",
      "status": "PASS",
      "url": "https://github.com/pavo-bit/erp/actions/runs/41305764290/job/124845701885",
      "commit": "93b3ed8087c2d842400113ba9f988c05bdbc6b28"
    },
    {
      "name": "backend-test (lane g)",
      "status": "FAIL",
      "url": "https://github.com/pavo-bit/erp/actions/runs/41305764290/job/124845701935",
      "commit": "93b3ed8087c2d842400113ba9f988c05bdbc6b28",
      "detail": "Fresh Vitest run: 13 files failed, 12 passed; 73 tests failed, 96 passed, 0 skipped (169 total)."
    },
    {
      "name": "frontend-build (erp-admin)",
      "status": "PASS",
      "url": "https://github.com/pavo-bit/erp/actions/runs/41305764290/job/124845701946",
      "commit": "93b3ed8087c2d842400113ba9f988c05bdbc6b28"
    }
  ],
  "requirements": [
    {
      "id": "QA-001",
      "status": "FAIL",
      "commands": ["npm run test:ci"],
      "ciJobs": [
        "backend-test (lane a)",
        "backend-test (lane b)",
        "backend-test (lane c)",
        "backend-test (lane d)",
        "backend-test (lane e)",
        "backend-test (lane f)",
        "backend-test (lane g)"
      ],
      "detail": "All seven lane matrix runs failed with 73 failed, 96 passed, and 0 skipped tests out of 169. This run validates only E head 93b3ed8087c2d842400113ba9f988c05bdbc6b28; it does not validate independent A/B/C branch commits."
    },
    {
      "id": "QA-002",
      "status": "UNVERIFIED",
      "commands": [
        "CI job-provisioned PostgreSQL and Redis lane matrix A-G",
        "npm run test:rls"
      ],
      "ciJobs": [
        "backend-test (lane a)",
        "backend-test (lane b)",
        "backend-test (lane c)",
        "backend-test (lane d)",
        "backend-test (lane e)",
        "backend-test (lane f)",
        "backend-test (lane g)",
        "Migrate and RLS Tests (restricted role)"
      ],
      "detail": "All lane services and restricted/trusted roles provisioned successfully; the RLS job passed, but matrix suites failed, so the full lane-isolation requirement remains unverified."
    }
  ]
}

